{
  "$schema": "https://json-schema.org/draft/2020-12/schema",
  "$id": "https://github.com/Nan0pk/Rush-linux/raw/main/schemas/hwtest-result.schema.json",
  "title": "Hardware Test Result",
  "description": "Per-run result for a single lever (baseline or optid). One hwtest-result.json per lever per bundle. Contains the power source, sample counts, per-phase per-metric measurements, and anomaly flags.",
  "type": "object",
  "required": [
    "schema_version",
    "result_kind",
    "lever",
    "power_source",
    "started_at",
    "finished_at",
    "phases"
  ],
  "additionalProperties": false,
  "properties": {
    "schema_version": {
      "type": "integer",
      "const": 1
    },
    "result_kind": {
      "type": "string",
      "const": "hwtest-result"
    },
    "lever": {
      "type": "string",
      "enum": ["baseline", "optid"],
      "description": "Which lever this result is for. 'baseline' = mainstream defaults (PPD balanced); 'optid' = optid --apply."
    },
    "power_source": {
      "type": "string",
      "enum": ["ac", "battery"],
      "description": "The power source during this run. 'battery' runs must have power_source=battery; 'ac' runs must have power_source=ac. The validator cross-checks this against the run's battery_pct and AC-online status."
    },
    "started_at": {
      "type": "string",
      "pattern": "^\\d{4}-\\d{2}-\\d{2}T\\d{2}:\\d{2}:\\d{2}Z$"
    },
    "finished_at": {
      "type": "string",
      "pattern": "^\\d{4}-\\d{2}-\\d{2}T\\d{2}:\\d{2}:\\d{2}Z$"
    },
    "phases": {
      "type": "array",
      "minItems": 1,
      "items": {
        "type": "object",
        "required": ["name", "expected_class", "observed_class", "metrics"],
        "additionalProperties": false,
        "properties": {
          "name": {
            "type": "string",
            "description": "Phase name (must match a phase in the plan)."
          },
          "expected_class": {
            "type": "string",
            "enum": ["idle", "light", "interactive", "latency-critical", "throughput", "vm-guest"]
          },
          "observed_class": {
            "type": "string",
            "enum": ["idle", "light", "interactive", "latency-critical", "throughput", "vm-guest"],
            "description": "The class optid actually resolved to. Must match expected_class (no class_mismatch)."
          },
          "metrics": {
            "type": "array",
            "minItems": 1,
            "items": {
              "type": "object",
              "required": ["name", "unit", "samples", "median", "n"],
              "additionalProperties": false,
              "properties": {
                "name": {
                  "type": "string",
                  "description": "Metric name (e.g. 'input-latency-p95-ms')."
                },
                "unit": {
                  "type": "string",
                  "description": "Metric unit (e.g. 'ms', 'watts', 'joules', 'iops')."
                },
                "samples": {
                  "type": "array",
                  "minItems": 1,
                  "items": {"type": "number"},
                  "description": "Raw sample values. Length must equal n."
                },
                "median": {"type": ["number", "null"]},
                "p95": {"type": ["number", "null"]},
                "iqr": {"type": ["number", "null"]},
                "n": {
                  "type": "integer",
                  "minimum": 1,
                  "description": "Number of samples. Must be >= plan.min_samples (no insufficient_n)."
                }
              }
            }
          }
        }
      }
    },
    "battery_pct": {
      "type": ["number", "null"],
      "minimum": 0,
      "maximum": 100,
      "description": "Battery percentage at run end (null for desktop slots or AC runs)."
    },
    "ac_online": {
      "type": ["boolean", "null"],
      "description": "Whether AC was online during the run (null for battery-only devices)."
    },
    "energy_joules": {
      "type": ["number", "null"],
      "minimum": 0,
      "description": "Total energy consumed during the run in joules (for Criterion 3 battery comparison)."
    },
    "anomalies": {
      "type": "array",
      "items": {"type": "string"},
      "description": "Anomaly flags (e.g. 'insufficient_n', 'class_mismatch', 'unsupported_here'). The validator rejects evidence with 'insufficient_n' or 'class_mismatch'."
    }
  }
}
