{
  "ac_online": false,
  "anomalies": [],
  "battery_pct": 80,
  "energy_joules": 1200.0,
  "finished_at": "2026-07-04T12:30:00Z",
  "lever": "optid",
  "phases": [
    {
      "expected_class": "interactive",
      "metrics": [
        {
          "iqr": 0.01,
          "median": 0.06,
          "n": 5,
          "name": "input-latency-p95-ms",
          "p95": 0.07,
          "samples": [
            0.06,
            0.06,
            0.06,
            0.07,
            0.06
          ],
          "unit": "ms"
        },
        {
          "iqr": 0.005,
          "median": 0.01,
          "n": 5,
          "name": "psi-cpu-avg10",
          "p95": 0.02,
          "samples": [
            0.01,
            0.01,
            0.02,
            0.01,
            0.01
          ],
          "unit": "ratio"
        }
      ],
      "name": "interactive",
      "observed_class": "interactive"
    },
    {
      "expected_class": "latency-critical",
      "metrics": [
        {
          "iqr": 0.1,
          "median": 16.6,
          "n": 5,
          "name": "frametime-p95-ms",
          "p95": 16.7,
          "samples": [
            16.5,
            16.6,
            16.7,
            16.5,
            16.6
          ],
          "unit": "ms"
        }
      ],
      "name": "latency-critical",
      "observed_class": "latency-critical"
    }
  ],
  "power_source": "battery",
  "result_kind": "hwtest-result",
  "schema_version": 1,
  "started_at": "2026-07-04T12:00:00Z"
}
